{
  "artifact_kind": "compact-trusted-frontier-receipt",
  "baseline": {
    "candidate_id": "89f6aa0078ce5b425092ccb86ca013d7d9b692c260716342b0cbdbb7e6ca42c9",
    "failure_count": 83,
    "hard_floor_status": "REFERENCE_NOT_CANDIDATE",
    "lineage": null,
    "pareto": {
      "commanded_pair_min": 16.63809304383975,
      "graphics_contrast_min": 2.8795558513774537,
      "max_commanded_deviation": 0.0,
      "mean_commanded_deviation": 0.0,
      "neutral_min": 9.518730110860718,
      "raster_1_5_min": 7.627912522515658,
      "raster_2_min": 10.996263425083491,
      "raster_3_min": 11.401609054497666,
      "transformed_pair_min": 14.831049664921375
    },
    "pareto_frontier_eligible": false,
    "row_kind": "baseline",
    "serialized_bank": [
      "#359984",
      "#281144",
      "#A76282",
      "#6A2600",
      "#185823",
      "#445D9B"
    ],
    "serialized_bank_sha256": "e0a4e8da3e1bf0f815b14ba2f8d75c479907aa58a3cb2abf4a2d8698f6d67c2b",
    "source": null,
    "strict_pareto_improvement": false
  },
  "browser_oracle_status": "NOT_RUN",
  "candidates": [
    {
      "candidate_id": "2f841cf76b0705b7b7b7bb7a6543bf4b50af9e88ee9b96c6b7e138abe24d812f",
      "failure_count": 0,
      "hard_floor_status": "PASS",
      "lineage": {
        "job_seed": 12485013394157907679,
        "parent_artifact_sha256": "87e212adee06be91627daf72ef6b78c471bef60eec8830cb2dab27bc2eb7c5bf",
        "parent_candidate_ids": [
          "2f841cf76b0705b7b7b7bb7a6543bf4b50af9e88ee9b96c6b7e138abe24d812f"
        ],
        "proposal_mode": "exact-coarse-survivor",
        "run_seed": 45002
      },
      "pareto": {
        "commanded_pair_min": 16.998792689757483,
        "graphics_contrast_min": 3.007529187491193,
        "max_commanded_deviation": 2.1029735768475013,
        "mean_commanded_deviation": 1.4486779331482091,
        "neutral_min": 9.551181997972465,
        "raster_1_5_min": 7.348061052807244,
        "raster_2_min": 10.578882089866397,
        "raster_3_min": 10.948480897298744,
        "transformed_pair_min": 16.05983880482016
      },
      "pareto_frontier_eligible": true,
      "row_kind": "candidate",
      "serialized_bank": [
        "#2D947E",
        "#301448",
        "#A45D7F",
        "#69250A",
        "#12541F",
        "#3A5E99"
      ],
      "serialized_bank_sha256": "ed527773fdef44a751a1daaf312dba03634d2d98cfb54f9c0b26530d655c72ad",
      "source": {
        "job_index": 1862,
        "row_position": 12,
        "shard_descriptor": {
          "file": "shard-000037.json",
          "index": 37,
          "record_count": 50,
          "sha256": "f6e03c1062b6c52b812e8eb8237a37868982ed3907075461d5c6c6d14681b01f",
          "start": 1850,
          "stop": 1900
        },
        "source_row_sha256": "a298554751deff7c4c3af33c17fcfccdb2d5f866f7058c499f8777932e3ee7fe"
      },
      "strict_pareto_improvement": false
    },
    {
      "candidate_id": "19ac839f58c92bf94095e77b176389b5208fb34a1370676d7957c50f859de82a",
      "failure_count": 0,
      "hard_floor_status": "PASS",
      "lineage": {
        "job_seed": 12040085792627241449,
        "parent_artifact_sha256": "87e212adee06be91627daf72ef6b78c471bef60eec8830cb2dab27bc2eb7c5bf",
        "parent_candidate_ids": [
          "19ac839f58c92bf94095e77b176389b5208fb34a1370676d7957c50f859de82a"
        ],
        "proposal_mode": "exact-coarse-survivor",
        "run_seed": 45002
      },
      "pareto": {
        "commanded_pair_min": 16.6170544714955,
        "graphics_contrast_min": 3.0393400840330917,
        "max_commanded_deviation": 2.4030372995851454,
        "mean_commanded_deviation": 1.7696091981597901,
        "neutral_min": 9.65637183921692,
        "raster_1_5_min": 7.684535125898803,
        "raster_2_min": 10.66821749246259,
        "raster_3_min": 10.936457370742819,
        "transformed_pair_min": 15.986413642254451
      },
      "pareto_frontier_eligible": true,
      "row_kind": "candidate",
      "serialized_bank": [
        "#279284",
        "#2A1045",
        "#A25E76",
        "#642505",
        "#0A521E",
        "#395B93"
      ],
      "serialized_bank_sha256": "7173c8b917f7e2382d7dbda3b66b3bcc7d6d989da17407b20e29980dd523fe89",
      "source": {
        "job_index": 3597,
        "row_position": 47,
        "shard_descriptor": {
          "file": "shard-000071.json",
          "index": 71,
          "record_count": 50,
          "sha256": "af6780d77ac2258487479d324afa7a859814af299fdd4eb0ca9016c270e7c639",
          "start": 3550,
          "stop": 3600
        },
        "source_row_sha256": "8a1fb409537b4e6d4330e55f975829e3ac0efc8f0755706a327b681f38811361"
      },
      "strict_pareto_improvement": false
    },
    {
      "candidate_id": "4648a9e8c10ea1d90bed18928e91938d796382c2375e8662a99df2f4a8f054b7",
      "failure_count": 0,
      "hard_floor_status": "PASS",
      "lineage": {
        "job_seed": 11576050461828707259,
        "parent_artifact_sha256": "87e212adee06be91627daf72ef6b78c471bef60eec8830cb2dab27bc2eb7c5bf",
        "parent_candidate_ids": [
          "4648a9e8c10ea1d90bed18928e91938d796382c2375e8662a99df2f4a8f054b7"
        ],
        "proposal_mode": "exact-coarse-survivor",
        "run_seed": 45002
      },
      "pareto": {
        "commanded_pair_min": 16.913640962558958,
        "graphics_contrast_min": 3.090322049692392,
        "max_commanded_deviation": 2.533436406704132,
        "mean_commanded_deviation": 1.8777788709270145,
        "neutral_min": 9.603751409384955,
        "raster_1_5_min": 7.151165218181563,
        "raster_2_min": 10.424282127447508,
        "raster_3_min": 10.818283866844089,
        "transformed_pair_min": 15.910751280006053
      },
      "pareto_frontier_eligible": true,
      "row_kind": "candidate",
      "serialized_bank": [
        "#3B947C",
        "#30164B",
        "#A05D78",
        "#652307",
        "#15531A",
        "#395B96"
      ],
      "serialized_bank_sha256": "7f09dc6561711253e4e6621acd11ce122565c84f1df28548503cb8b627026382",
      "source": {
        "job_index": 4087,
        "row_position": 37,
        "shard_descriptor": {
          "file": "shard-000081.json",
          "index": 81,
          "record_count": 50,
          "sha256": "79f3d0f5742a3d6e440fa48275a066051794a5ee3871ad3eb0c0e2464c089240",
          "start": 4050,
          "stop": 4100
        },
        "source_row_sha256": "00274226febdfc7a27b4547fbb8c5e36d2e5d486aac5e45b5a2fc11d94f91e1e"
      },
      "strict_pareto_improvement": false
    },
    {
      "candidate_id": "526615169cba4379bfbc28c505e225ec33b1418fbf87860e33a99bc92e9f7fb4",
      "failure_count": 0,
      "hard_floor_status": "PASS",
      "lineage": {
        "job_seed": 6228451094378910873,
        "parent_artifact_sha256": "87e212adee06be91627daf72ef6b78c471bef60eec8830cb2dab27bc2eb7c5bf",
        "parent_candidate_ids": [
          "526615169cba4379bfbc28c505e225ec33b1418fbf87860e33a99bc92e9f7fb4"
        ],
        "proposal_mode": "exact-coarse-survivor",
        "run_seed": 45002
      },
      "pareto": {
        "commanded_pair_min": 17.077531842141727,
        "graphics_contrast_min": 3.0002236771585924,
        "max_commanded_deviation": 1.6946630424750566,
        "mean_commanded_deviation": 1.0502298499511646,
        "neutral_min": 8.844420120701317,
        "raster_1_5_min": 7.066168760817645,
        "raster_2_min": 10.407875231843274,
        "raster_3_min": 10.841399317567284,
        "transformed_pair_min": 15.409910501198695
      },
      "pareto_frontier_eligible": true,
      "row_kind": "candidate",
      "serialized_bank": [
        "#3B937F",
        "#2C113F",
        "#A35F7C",
        "#6C2602",
        "#1A571F",
        "#3C5C9B"
      ],
      "serialized_bank_sha256": "a7b3d8f010e9ff559e2fa3ed5ce7a780f6a71312936ece79cb1fb7423d4fd7bb",
      "source": {
        "job_index": 1078,
        "row_position": 28,
        "shard_descriptor": {
          "file": "shard-000021.json",
          "index": 21,
          "record_count": 50,
          "sha256": "86f9de13626bf4a5ed67aa3f32d7773336894635d31cd103acda732a968c697c",
          "start": 1050,
          "stop": 1100
        },
        "source_row_sha256": "add6556b2d72f593444cab492f79d151f3418fab477339a9ded8b6e1cee67e5e"
      },
      "strict_pareto_improvement": false
    },
    {
      "candidate_id": "c03a813eae8918ddbabfd56657806e6c2f5d3fc69c292ef3b5955c9d734fd8ed",
      "failure_count": 0,
      "hard_floor_status": "PASS",
      "lineage": {
        "job_seed": 9382895931826650380,
        "parent_artifact_sha256": "87e212adee06be91627daf72ef6b78c471bef60eec8830cb2dab27bc2eb7c5bf",
        "parent_candidate_ids": [
          "c03a813eae8918ddbabfd56657806e6c2f5d3fc69c292ef3b5955c9d734fd8ed"
        ],
        "proposal_mode": "exact-coarse-survivor",
        "run_seed": 45002
      },
      "pareto": {
        "commanded_pair_min": 16.72920667580417,
        "graphics_contrast_min": 3.016762457034204,
        "max_commanded_deviation": 1.6204211233592527,
        "mean_commanded_deviation": 1.1036534616491642,
        "neutral_min": 8.989924034245409,
        "raster_1_5_min": 7.195737817340512,
        "raster_2_min": 10.175594323446962,
        "raster_3_min": 10.489454526290187,
        "transformed_pair_min": 15.281993944345091
      },
      "pareto_frontier_eligible": true,
      "row_kind": "candidate",
      "serialized_bank": [
        "#34947F",
        "#2C1444",
        "#A25F7E",
        "#692506",
        "#115825",
        "#3C5B94"
      ],
      "serialized_bank_sha256": "523af49c96cb5a7f82ecf91803bd7b927a698e2875e589e59ef2fcf2c97c1150",
      "source": {
        "job_index": 3032,
        "row_position": 32,
        "shard_descriptor": {
          "file": "shard-000060.json",
          "index": 60,
          "record_count": 50,
          "sha256": "fae9112fb0da323d3b859dba2483ced1baf5a4f87d40354ce99f858dc4548993",
          "start": 3000,
          "stop": 3050
        },